"1000001","1","35.711151","139.79638","浅草寺","雷門","","東京都","台東区二丁目","","Wikipedia","2017.09.19","https://ja.wikipedia.org/wiki/%E9%9B%B7%E9%96%80","雷門は浅草寺の山門。正式名称は風雷神門。「雷門」と書かれた提灯の逆側には「風雷神門」と書かれている。<br>雷門にかかる大提灯は高さ3.9m、直径3.3m、重さ約700kg。浅草のランドマークとなっている。","浅草寺 公式サイト","http://www.senso-ji.jp/","1011011011","1","0","C","101","101","","2017.09.02","2017.09.19"
"1000002","1","35.7358","139.735538","高岩寺","とげぬき地蔵","","東京都","豊島区巣鴨三丁目","","Wikipedia","2017.09.19","https://ja.wikipedia.org/wiki/%E9%AB%98%E5%B2%A9%E5%AF%BA","高岩寺は東京都豊島区巣鴨にある曹洞宗の寺院。山号は萬頂山。<br>本尊の地蔵菩薩像（延命地蔵）は秘仏につき非公開。一般にはとげぬき地蔵の通称で知られる。<br>境内に立つ石造の聖観音像は「洗い観音」と通称され、自身の治癒したい部分に相応する観音像の部分を洗う、または濡れタオルで拭くと利益があるという。","巣鴨地蔵通り商店街","http://www.sugamo.or.jp/index.php","1011011021","1","0","C","101","101","","2017.09.02","2017.09.19"
"1000003","1","35.65867","139.745392","東京タワー","","","東京都","港区芝公園四丁目","","Wikipedia","2017.09.19","https://ja.wikipedia.org/wiki/%E6%9D%B1%E4%BA%AC%E3%82%BF%E3%83%AF%E3%83%BC","東京タワーは東京都港区芝公園にある総合電波塔の愛称。正式名称は日本電波塔。<br>高さは333m。塔脚の間隔は88m。1958年12月23日竣工。東京のシンボル・観光名所として知られる。<br>自立式鉄塔としては東京スカイツリーに抜かれるまでの約51年半は日本一の高さであった。","東京タワー TokyoTower","https://www.tokyotower.co.jp/","1011011031","1","0","L","101","101","","2017.09.02","2017.09.19"
"1000004","1","35.660457","139.729256","六本木ヒルズ","","","東京都","港区六本木六丁目","","Wikipedia","2017.09.19","https://ja.wikipedia.org/wiki/%E5%85%AD%E6%9C%AC%E6%9C%A8%E3%83%92%E3%83%AB%E3%82%BA","六本木ヒルズは2003年4月に開業した複合商業施設。<br>高さ238m、54階建ての六本木ヒルズ森タワーを中心に、集合住宅、ホテル、テレビ朝日本社社屋、映画館をはじめその他の商業施設等で構成されている。<br>港区指定の非常災害用井戸や備蓄倉庫、特定電気事業施設などを備え防災関連施設にもなっている。","六本木ヒルズ - Roppongi Hills","http://www.roppongihills.com/","1011011041","1","0","C","101","101","","2017.09.02","2017.09.19"
"1000005","1","35.676392","139.699344","明治神宮","","","東京都","渋谷区代々木神園町","","Wikipedia","2017.09.19","https://ja.wikipedia.org/wiki/%E6%98%8E%E6%B2%BB%E7%A5%9E%E5%AE%AE","明治神宮は東京都渋谷区にある神社。明治天皇と昭憲皇太后を祭神とする。<br>1920年（大正9年）創健。正式な表記は「宮」の「呂」の中間の線が入らない「明治神宫」。<br>本殿を中心に神楽殿、宝物殿、武道場至誠館などがあり、初詣では例年日本一の参拝者数を誇る。","明治神宮","http://www.meijijingu.or.jp/","1011011051","1","0","R","101","101","","2017.09.02","2017.09.19"
"1000006","1","35.685172","139.709593","新宿御苑","","","東京都","新宿区、渋谷区","","Wikipedia","2017.09.23","https://ja.wikipedia.org/wiki/%E6%96%B0%E5%AE%BF%E5%BE%A1%E8%8B%91","新宿御苑は、東京都新宿区と渋谷区に跨る環境省所管の庭園。<br>もともとは江戸時代に信濃高遠藩内藤家の下屋敷のあった敷地である。<br>1879年に新宿植物御苑が開設され、宮内省（現在の宮内庁）の管理であったが、第二次世界大戦後は一般に公開され、現在は環境省管轄の国民公園として親しまれている。","新宿御苑 | 一般財団法人国民公園協会","http://fng.or.jp/shinjuku/","1011011071","1","0","C","101","101","","2017.09.23","2017.09.23"
"1000007","1","35.651136","139.827803","夢の島公園","","","東京都","江東区夢の島","","Wikipedia","2017.09.23","https://ja.wikipedia.org/wiki/%E5%A4%A2%E3%81%AE%E5%B3%B6","夢の島は東京都江東区の町名。元は東京湾埋立14号地。<br>1939年の飛行場建設が埋め立ての始まりだが、資材不足により中止。その後、東京都のゴミ処分場に指定され、1957年から1967年まで埋め立てが続いた。<br>1978年にかつてのゴミの島は整備され、夢の島公園が開園する。","【東京都】夢の島公園 夢の島熱帯植物","http://www.yumenoshima.jp/","1011011081","1","0","C","101","101","","2017.09.23","2017.09.23"
"1000008","1","35.631692","139.70665","目黒寄生虫館","","","東京都","目黒区下目黒四丁目","","Wikipedia","2017.10.18","https://ja.wikipedia.org/wiki/%E7%9B%AE%E9%BB%92%E5%AF%84%E7%94%9F%E8%99%AB%E9%A4%A8","目黒寄生虫館は世界で唯一の寄生虫を専門とした博物館。寄生虫に関する研究・展示・資料収集・鑑定・啓蒙活動等を行っている。<br>物珍しさと怖いもの見たさからデートスポットとして知られるほか、サブカルチャーの分野で取り上げられることも多い。","公益財団法人目黒寄生虫館","http://www.kiseichu.org/","1011011091","1","0","C","101","101","","2017.10.18","2017.10.18"
"1000009","1","35.835957","139.806851","おせん公園","草加せんべい発祥の地の碑","","埼玉県","草加市神明一丁目","","Wikipedia","2017.09.20","https://ja.wikipedia.org/wiki/%E8%8D%89%E5%8A%A0%E7%85%8E%E9%A4%85","草加煎餅とは埼玉県草加市の名産品の煎餅。また草加煎餅協同組合・草加地区手焼煎餅協同組合の地域団体商標である。<br>米を団子状にしてから乾燥させ保存食としていたものを、江戸時代に草加宿で販売したのが発祥としている。<br>草加市内には煎餅の製造所や販売所は60軒以上存在している。","草加煎餅公式サイト","http://www.sokasenbei.com/","1011021011","1","0","L","101","102","","2017.09.04","2017.09.20"
"1000010","1","35.916517","139.629915","氷川神社","","","埼玉県","さいたま市大宮区高鼻町一丁目","","Wikipedia","2017.09.20","https://ja.wikipedia.org/wiki/%E6%B0%B7%E5%B7%9D%E7%A5%9E%E7%A4%BE","氷川神社は埼玉県さいたま市大宮区高鼻町にある神社。東京都・埼玉県近辺に約200社ある氷川神社の総本社である。<br>他の氷川神社と区別する際は「大宮氷川神社」とも呼ばれる。<br>現在の主祭神は須佐之男命（すさのおのみこと）、稲田姫命（いなだひめのみこと）、大己貴命（おおなむちのみこと）の3柱。","武蔵一宮　氷川神社","http://musashiichinomiya-hikawa.or.jp/","1011021021","1","0","L","101","102","","2017.09.04","2017.09.20"
"1000011","1","35.925846","139.491513","川越市立博物館","","","埼玉県","川越市郭町二丁目","","Wikipedia","2017.09.20","https://ja.wikipedia.org/wiki/%E5%B7%9D%E8%B6%8A%E5%B8%82","江戸時代、川越藩はサツマイモの名産地であった。<br>寛政年間に焼き芋が流行。将軍・徳川家治に献上されて「川越芋」の名がついたと言われる。<br>2008年までサツマイモ資料館が開館しており、閉館後は川越市立博物館に資料が寄贈されている。","川越市立博物館ホームページ","http://museum.city.kawagoe.saitama.jp/","1011021031","1","0","C","101","102","","2017.09.04","2017.09.20"
"1000012","1","35.953473","139.052448","浦山ダム","","","埼玉県","秩父市荒川久那","","Wikipedia","2017.09.20","https://ja.wikipedia.org/wiki/%E6%B5%A6%E5%B1%B1%E3%83%80%E3%83%A0","浦山ダムは埼玉県秩父市浦山地先、荒川水系浦山川に建設されたダム。堤高156.0m<br>1998年に28年の歳月を掛けて完成にこぎ着け、翌1999年より使用を開始した。<br>ダム湖は「秩父さくら湖」と命名され、春には湖畔にサクラが咲き乱れる。","荒川ダム総合管理所（浦山ダム・滝沢ダム）","http://www.water.go.jp/kanto/arakawa/","1011021041","1","0","R","101","102","","2017.09.04","2017.09.20"
"1000013","1","35.997545","139.084141","秩父神社","","","埼玉県","秩父市番場町","","Wikipedia","2017.09.20","https://ja.wikipedia.org/wiki/%E7%A7%A9%E7%88%B6%E5%A4%9C%E7%A5%AD","秩父夜祭は埼玉県秩父市にある秩父神社の例祭。<br>毎年12月1日から6日に行われ、提灯で飾り付けられた山車の曳き回しや、冬の花火大会で全国的に知られている。<br>300年以上の歴史があり、ユネスコ無形文化遺産に登録されている。","秩父神社","http://www.chichibu-jinja.or.jp/","1011021051","1","0","L","101","102","","2017.09.04","2017.09.20"
"1000014","1","36.365754","139.723685","栃木乳業株式会社","","","栃木県","栃木市大平町","","Wikipedia","2017.09.21","https://ja.wikipedia.org/wiki/%E3%83%AC%E3%83%A2%E3%83%B3%E7%89%9B%E4%B9%B3","レモン牛乳とは栃木県内の製乳メーカーが生産している乳飲料。<br>無脂肪牛乳や生乳に甘味とレモンの香りを加え黄色く着色した飲料の通称である。<br>第二次世界大戦後間もない頃「関東レモン牛乳」が発売され、2004年9月に生産中止となった後、2005年1月に「関東・栃木レモン」の名で復活した。","レモン牛乳の栃木乳業株式会社","http://www.tochigimilk.co.jp/","1011031011","1","0","R","101","103","","2017.09.04","2017.09.21"
"1000015","1","36.559196","139.897608","宇都宮駅","餃子像","","栃木県","宇都宮市川向町","","Wikipedia","2017.09.21","https://ja.wikipedia.org/wiki/%E5%AE%87%E9%83%BD%E5%AE%AE%E5%B8%82","宇都宮市は「餃子の街」として全国的に有名。市内には餃子を扱う飲食店が専門店を含めて約二百軒ある。<br>宇都宮駅西口には『餃子像』が設置されている。<br>中国大陸に派遣された師団本部が宇都宮にあり、帰還兵によって多くの餃子屋が市内にできたのが始まりといわれる。","宇都宮餃子会","http://www.gyozakai.com/","1011031021","1","0","C","101","103","","2017.09.04","2017.09.21"
"1000016","1","36.444321","139.945973","鬼怒川自然公園","","","栃木県","真岡市柳林","","Wikipedia","2017.09.21","https://ja.wikipedia.org/wiki/%E9%AC%BC%E6%80%92%E5%B7%9D","鬼怒川は、関東平野を北から南へと流れ利根川に合流する一級河川である。全長176.7kmで、利根川の支流の中で最も長い。<br>鬼怒川水系の豊富で上質な水は上水、灌漑用水として流域の農業や工業に広く利用されている。<br>宇都宮市で盛んな飲料製造業は鬼怒川の清水に拠るものである。","栃木県鬼怒川漁協","http://www.kinugawa-gyokyou.com/","1011031031","1","1","L","101","103","","2017.09.04","2017.09.21"
"1000017","1","37.12384","140.052339","那須アルパカ牧場","","","栃木県","那須郡那須町大字大島","","Wikipedia","2017.09.21","https://ja.wikipedia.org/wiki/%E3%82%A2%E3%83%AB%E3%83%91%E3%82%AB","アルパカは南アメリカ大陸原産の家畜。<br>極めて良質な体毛を具えており、古来より衣類を始めとする生活用品へ加工利用されている。<br>日本では1981年に東武動物公園で国内初のアルパカの飼育を開始。1999年に那須アルパカ牧場が牧場飼育を開始した。","アルパカ牧場　那須ビッグファーム","http://www.nasubigfarm.com/","1011031042","1","0","C","101","103","","2017.09.04","2017.09.21"
"1000018","1","36.757152","139.59999","日光東照宮","","","栃木県","日光市山内","","Wikipedia","2017.09.21","https://ja.wikipedia.org/wiki/%E6%97%A5%E5%85%89%E6%9D%B1%E7%85%A7%E5%AE%AE","日光東照宮は栃木県日光市に所在する神社。江戸幕府初代将軍・徳川家康を神格化した東照大権現を祀る。<br>日本全国の東照宮の総本社的存在であり、正式名称は「東照宮」だが、他の東照宮との区別のために「日光東照宮」と呼ばれることが多い。","日光東照宮ホームページ","http://www.toshogu.jp/","1011031051","1","0","C","101","103","","2017.09.04","2017.09.21"
"1000019","1","36.337697","139.451661","足利氏宅跡（鑁阿寺）","","","栃木県","足利市家富町","","Wikipedia","2017.09.24","https://ja.wikipedia.org/wiki/%E8%B6%B3%E5%88%A9%E5%B0%8A%E6%B0%8F","足利尊氏は室町幕府の初代征夷大将軍。<br>出生は栃木県の足利荘とされることが多かったが、資料に乏しく90年代以降では概ね否定されている。<br>鑁阿寺（ばんなじ）は元は足利氏の館であり、国の史跡に指定されている。日本100名城の一つ。現在でも鎌倉時代前後の武士の館の面影が残されている。","国宝　鑁阿寺","http://www.ashikaga-bannaji.org/index.html","1011031061","1","0","R","101","103","","2017.09.24","2017.09.24"
"1000020","1","35.316846","139.53572","高徳院","鎌倉大仏","","神奈川県","鎌倉市長谷四丁目","","Wikipedia","2017.09.21","https://ja.wikipedia.org/wiki/%E9%AB%98%E5%BE%B3%E9%99%A2","高徳院は神奈川県鎌倉市長谷にある浄土宗の寺院。本尊は「鎌倉大仏」「長谷の大仏」として知られる阿弥陀如来像（国宝）。<br>2004年2月27日に境内一帯が「鎌倉大仏殿跡」の名称で国の史跡に指定された。<br>高徳院の開山、開基は不明であり、大仏の造像の経緯についても史料が乏しく不明な点が多い。","鎌倉大仏殿高徳院","http://www.kotoku-in.jp/","1011041011","1","0","L","101","104","","2017.09.05","2017.09.21"
"1000021","1","35.44359","139.645684","聘珍樓","横濱本店","","神奈川県","神奈川県横浜市中区山下町","","Wikipedia","2017.09.21","https://ja.wikipedia.org/wiki/%E3%82%B5%E3%83%B3%E3%83%9E%E3%83%BC%E3%83%A1%E3%83%B3","サンマーメンは細麺を使った塩もしくは醤油ラーメンの上に、歯ごたえが残る程度に炒めたモヤシ入りのあんをかけた麺料理である。<br>神奈川県ではご当地ラーメンとしてアピールしている。<br>サンマーメン（生碼麺）は昭和5年に聘珍樓の当時の料理長が考案したとされる。","聘珍樓（へいちんろう）","http://www.heichin.com/","1011041021","1","0","R","101","104","","2017.09.05","2017.09.21"
"1000022","1","35.24604","139.129865","かまぼこの里","","","神奈川県","小田原市本町三丁目","","Wikipedia","2017.09.21","https://ja.wikipedia.org/wiki/%E5%B0%8F%E7%94%B0%E5%8E%9F%E5%B8%82","小田原市は小田原漁港など水産加工品の製造が盛ん。特にかまぼこは小田原の特産品として各地に販路を広げている。<br>蒲鉾は練り製品の一つ。原料魚にはタラ類、サメ類、イトヨリ、ベラ類他の白身魚が使用される。","鈴廣かまぼこの里","https://www.kamaboko.com/sato/","1011041031","1","0","C","101","104","","2017.09.05","2017.09.21"
"1000023","1","35.299768","139.478426","江の島シーキャンドル","","","神奈川県","藤沢市江の島二丁目","","Wikipedia","2017.09.21","https://ja.wikipedia.org/wiki/%E6%B1%9F%E3%81%AE%E5%B3%B6%E7%81%AF%E5%8F%B0","江の島灯台は神奈川県藤沢市江の島に立つ日本初の民間灯台。<br>2002年12月31日に江ノ島電鉄開業100周年記念事業のフィナーレとして点灯式において初点灯された。<br>2003年4月から江の島観光灯台として展望台が開業した。","江の島シーキャンドル (展望灯台) 江の島サムエルコッキング苑","https://enoshima-seacandle.com/","1011041041","1","0","R","101","104","","2017.09.05","2017.09.21"
"1000024","1","35.442351","139.646402","横浜中華街","","","神奈川県","横浜市中区山下町","","Wikipedia","2017.09.21","https://ja.wikipedia.org/wiki/%E6%A8%AA%E6%B5%9C%E4%B8%AD%E8%8F%AF%E8%A1%97","横浜中華街は、神奈川県横浜市中区山下町一帯に所在するチャイナタウン（中華街）である。<br>約0.2平方キロのエリア内に500店以上の店舗があり、日本最大かつ東アジア最大の中華街となっている。<br>1866年の横浜新田慰留地から数えると150年弱の歴史をもつことになる。","［公式］横浜中華街","http://www.chinatown.or.jp/","1011041051","1","0","L","101","104","","2017.09.05","2017.09.21"
"1000025","1","35.665833","140.318046","八街市","","","千葉県","八街市","","Wikipedia","2017.09.22","https://ja.wikipedia.org/wiki/%E3%83%A9%E3%83%83%E3%82%AB%E3%82%BB%E3%82%A4","県別の生産量では、千葉県が9590トンで突出しており、78.0%を生産している。特に千葉県中央部の八街市が生産量では日本一を誇る。","落花生｜旬鮮図鑑／千葉県","https://www.pref.chiba.lg.jp/ryuhan/pbmgm/zukan/kome/rakkase.html","1011051011","1","1","C","101","105","","2017.09.06","2017.09.22"
"1000026","1","35.46409","139.874752","東京湾アクアライン","海ほたる","","千葉県","木更津市中島地先海ほたる","","Wikipedia","2017.09.22","https://ja.wikipedia.org/wiki/%E6%B5%B7%E3%81%BB%E3%81%9F%E3%82%8B%E3%83%91%E3%83%BC%E3%82%AD%E3%83%B3%E3%82%B0%E3%82%A8%E3%83%AA%E3%82%A2","海ほたるパーキングエリアは東京湾アクアライン上にあるパーキングエリア。<br>東日本高速道路が管理する人工島、「木更津人工島」に位置する。<br>海ほたるでは来た方向にUターンして引き返すことができ、通行料金は対岸に行く場合と同額である。","海ほたる～東京湾に浮かぶパーキングエリア","https://www.umihotaru.com/","1011051021","1","0","C","101","105","","2017.09.06","2017.09.22"
"1000027","1","34.996555","139.870096","館山市、南房総市周辺","","","千葉県","館山市、南房総市","","Wikipedia","2017.09.22","https://ja.wikipedia.org/wiki/%E6%88%BF%E5%B7%9E%E3%81%86%E3%81%A1%E3%82%8F","房州うちわは千葉県南房総市、館山市特産のうちわ。千葉県の伝統工芸の一つ。<br>京うちわ、丸亀うちわと並ぶ日本三大うちわの一つである。<br>1923年に関東大震災で被災した東京のうちわ問屋が現在の館山市船形へ移住し、房州でのうちわ生産が本格化する。最盛期には年産800万本に達した。","房州うちわ振興協会","http://www.bosyu-uchiwa.com/","1011051031","1","1","L","101","105","","2017.09.06","2017.09.22"
"1000028","1","35.115997","140.120475","鴨川シーワールド","","","千葉県","鴨川市東町","","Wikipedia","2017.09.22","https://ja.wikipedia.org/wiki/%E9%B4%A8%E5%B7%9D%E3%82%B7%E3%83%BC%E3%83%AF%E3%83%BC%E3%83%AB%E3%83%89","鴨川シーワールドは千葉県鴨川市の東条海岸と国道128号に挟まれて立地する大規模な総合海洋レジャーセンター・博物館相当施設。<br>1970年に開業し、シャチの飼育は日本初。他にもイルカやアシカなど海獣の展示飼育に力を入れている。","＜公式＞鴨川シーワールド","http://www.kamogawa-seaworld.jp/","1011051041","1","0","C","101","105","","2017.09.06","2017.09.22"
"1000029","1","34.996206","139.857844","北条海岸","南総里見まつり会場","","千葉県","館山市","","Wikipedia","2017.09.22","https://ja.wikipedia.org/wiki/%E5%8D%97%E7%B7%8F%E9%87%8C%E8%A6%8B%E5%85%AB%E7%8A%AC%E4%BC%9D","『南総里見八犬伝』は江戸時代後期に曲亭馬琴によって著わされた大長編読本。<br>1814年に刊行が開始され、28年をかけて完結した全98巻、106冊の大作である。<br>館山市では1982年より毎年10月に南総里見まつりが開催され、八犬伝の世界を再現する仮装パレードが行われる。","南総里見まつり","http://satomi.tateyamacity.com/","1011051051","1","0","R","101","105","","2017.09.06","2017.09.22"
"1000030","1","36.371011","140.476179","水戸市","","","茨城県","水戸市","","","","","茨城県水戸市内の納豆メーカー４社。<br>・株式会社笹沼五郎商店<br>・天狗納豆株式会社<br>・だるま食品株式会社<br>・水戸納豆製造株式会社","","","1011061012","1","1","L","101","106","水戸納豆を代表する場所を特定できず、水戸駅に設定しています。<br>水戸駅では各種水戸納豆が販売されています。","2017.09.06","2017.11.12"
"1000031","1","36.310836","140.570753","大洗マリンタワー前広場","大洗あんこう祭会場","","茨城県","東茨城郡大洗町","","Wikipedia","2017.09.23","https://ja.wikipedia.org/wiki/%E5%A4%A7%E6%B4%97%E3%81%82%E3%82%93%E3%81%93%E3%81%86%E7%A5%AD","大洗あんこう祭は茨城県東茨城郡大洗町で行われている祭。<br>アンコウの吊るし切りや、アンコウ汁の販売が行われる。1998年より始まり、近年は毎年11月に開催されている。<br>2012年より大洗町が舞台のアニメ『ガールズ&パンツァー』の関連イベントが行われ、ファンが多数来客するようになった。","大洗観光協会 『よかっぺ大洗』","http://www.oarai-info.jp/top.htm","1011061021","1","0","L","101","106","","2017.09.06","2017.09.23"
"1000032","1","35.994109","140.148016","明恒パール","","","茨城県","牛久市猪子町","","Wikipedia","2017.09.23","https://ja.wikipedia.org/wiki/%E9%9C%9E%E3%83%B6%E6%B5%A6","イケチョウガイやカラス貝といった淡水生の貝の中に出来る真珠は淡水パールと呼ばれる。<br>霞ヶ浦の浮島付近や江戸崎などでは淡水真珠の養殖が行われており、2000年の淡水真珠の浜揚量は135kgで、これは全国（181kg）のうちの約75％になる。","明恒パール牛久観光株式会社","http://www.meiko-pearl.co.jp/","1011061031","1","0","L","101","106","","2017.09.06","2017.09.23"
"1000033","1","36.097078","140.403255","霞ヶ浦ふれあいランド","","","茨城県","行方市玉造","","Wikipedia","2017.09.23","https://ja.wikipedia.org/wiki/%E9%9C%9E%E3%83%B6%E6%B5%A6%E3%81%B5%E3%82%8C%E3%81%82%E3%81%84%E3%83%A9%E3%83%B3%E3%83%89","霞ヶ浦ふれあいランドは茨城県行方市玉造甲にある行方市立のレジャー施設である。<br>霞ヶ浦や筑波山を眺望出来る高さ60mのシンボルタワーである虹の塔のほか、水について学ぶことができる水の科学館などの様々な施設が設置されている。<br>物産販売所こいこい、道の駅たまつくりが隣接。","行方市観光物産館こいこい","http://www.namegata-koikoi.com/","1011061041","1","0","C","101","106","","2017.09.06","2017.09.23"
"1000034","1","36.068552","140.129369","筑波宇宙センター","","","茨城県","つくば市千現","","Wikipedia","2017.09.23","https://ja.wikipedia.org/wiki/%E7%AD%91%E6%B3%A2%E5%AE%87%E5%AE%99%E3%82%BB%E3%83%B3%E3%82%BF%E3%83%BC","筑波宇宙センターは茨城県つくば市の筑波研究学園都市内にある宇宙航空研究開発機構（JAXA）が所有する宇宙開発計画関連の独立行政法人施設である。<br>一般見学者が入れる展示館や、宇宙開発関連図書が専門の図書館があり、年に2回、4月と10月に特別公開を実施している。","JAXA｜宇宙航空研究開発機構","http://www.jaxa.jp/","1011061051","1","0","R","101","106","","2017.09.06","2017.09.23"
"1000035","1","36.371879","140.445902","徳川ミュージアム","","","茨城県","水戸市見川","","Wikipedia","2017.09.24","https://ja.wikipedia.org/wiki/%E6%B0%B4%E6%88%B8%E9%BB%84%E9%96%80","水戸黄門とは江戸時代の水戸藩主・徳川光圀の別称。または、徳川光圀が隠居して日本各地を漫遊しながら世直しをする創作物語のタイトル。<br>実際には光圀が諸国を漫遊した記録はなく、隠居後は西山荘（茨城県常陸太田市）に移り歴史書『大日本史』の編纂に尽力した。<br>徳川ミュージアムでは水戸徳川家の史料を見ることができる。","公益財団法人 徳川ミュージアム","http://www.tokugawa.gr.jp/","1011061061","1","0","R","101","106","","2017.09.24","2017.09.24"
"1000036","1","36.230028","138.743536","下仁田こんにゃく観光センター","","","群馬県","甘楽郡下仁田町東野牧","","Wikipedia","2017.09.23","https://ja.wikipedia.org/wiki/%E3%82%B3%E3%83%B3%E3%83%8B%E3%83%A3%E3%82%AF","コンニャクはサトイモ科の植物、あるいはその球茎から製造される食品である。<br>コンニャクの原料となるコンニャクイモの2007年度の収穫量は66,900tで主産地は群馬県 (89.5%) 。<br>和食ブームとともに低カロリーの健康食品として欧米にも広がりつつある。","下仁田こんにゃく観光センター","http://www.tabi254.jp/","1011071011","1","0","R","101","107","","2017.09.06","2017.09.23"
