"1000137","2","39.701887","141.13633","盛岡市","","","岩手県","盛岡市","","Wikipedia","2017.12.30","https://ja.wikipedia.org/wiki/%E3%82%8F%E3%82%93%E3%81%93%E3%81%9D%E3%81%B0","わんこそばは岩手県（花巻、盛岡）に伝わる蕎麦のひとつ。<br>熱いそばつゆをくぐらせた一口大のそばを客のお椀に入れ、食べ終わるたびに、給仕がそのお椀に次々とそばを入れ続ける。客が満腹になりふたを閉めるまで続けられる。<br>盛岡市には多くのわんこそばを食べることができる店がある。","モリオカ三大麺","http://moriokasandaimen.com/","1041051011","1","1","L","104","105","わんこそば の店は多くあるため、場所を特定していません。","2017.12.30","2017.12.30"
"1000138","1","39.327949","141.528695","遠野市立博物館","","","岩手県","遠野市東舘町","","Wikipedia","2017.12.30","https://ja.wikipedia.org/wiki/%E5%BA%A7%E6%95%B7%E7%AB%A5%E5%AD%90","遠野物語は柳田國男が1910年に発表した遠野地方に伝わる逸話、伝承などを記した説話集。<br>内容は天狗、河童、座敷童子などの妖怪から山人、マヨヒガ、神隠し、臨死体験、祀られる神とそれを奉る行事や風習など多岐に渡る。<br>遠野市立博物館は遠野物語を軸に遠野の人々の自然や暮らし、文化、歴史を紹介している。","遠野文化研究センター","http://tonoculture.com/","1041051021","1","0","R","104","105","","2017.12.30","2017.12.30"
"1000139","1","39.001363","141.099877","中尊寺","中尊寺金色堂","","岩手県","西磐井郡平泉町平泉衣関","","Wikipedia","2017.12.30","https://ja.wikipedia.org/wiki/%E4%B8%AD%E5%B0%8A%E5%AF%BA%E9%87%91%E8%89%B2%E5%A0%82","中尊寺金色堂は西磐井郡平泉町の中尊寺にある平安時代後期建立の仏堂。名の通り堂の木瓦部分以外は内外共に総金箔貼り。<br>堂は1965年建設の鉄筋コンクリート造の覆堂内にあり、ガラスケースに納められて外気と遮断されている。<br>須弥壇内には、藤原清衡、基衡、秀衡のミイラ化した遺体と泰衡の首級が納められている。","金色堂","http://www.chusonji.or.jp/guide/precincts/konjikido.html","1041051031","1","0","C","104","105","","2017.12.30","2017.12.30"
"1000140","1","39.750873","141.016285","小岩井農場","","","岩手県","岩手郡雫石町丸谷地","","Wikipedia","2017.12.30","https://ja.wikipedia.org/wiki/%E5%B0%8F%E5%B2%A9%E4%BA%95%E8%BE%B2%E5%A0%B4","小岩井農場は岩手郡雫石町にある日本最大の民間総合農場。<br>岩手山南麓に約3,000ヘクタールの広大な敷地面積を有する。<br>1891年、日本鉄道会社副社長の小野義眞、三菱社社長の岩崎彌之助、鉄道庁長官の井上勝の三名が共同創始者となり3名の姓の頭文字を採り「小岩井」農場と名付けられた。","小岩井農場","https://www.koiwai.co.jp/makiba/index.html","1041051041","1","0","R","104","105","","2017.12.30","2017.12.30"
"1000141","1","39.399095","141.162316","宮沢賢治記念館","","","岩手県","花巻市矢沢第1地割","","Wikipedia","2017.12.30","https://ja.wikipedia.org/wiki/%E5%AE%AE%E6%B2%A2%E8%B3%A2%E6%B2%BB","宮沢賢治は日本の詩人、童話作家。<br>仏教信仰と農民生活に根ざした創作を行い、作品中に登場する架空の理想郷に、岩手をモチーフとしてイーハトーブと名付けた。生前は無名に近かったが、没後、作品群が広く知られ、国民的作家となった。<br>宮沢賢治記念館では宮沢賢治の世界の解説や創作過程が展示されている。","宮沢賢治記念館","http://www.city.hanamaki.iwate.jp/bunkasports/501/miyazawakenji/p004116.html","1041051052","1","0","C","104","105","","2017.12.30","2017.12.30"
"1000142","1","39.357171","141.569343","伝承園","","","岩手県","淵町土淵6地割","","Wikipedia","2017.12.30","https://ja.wikipedia.org/wiki/%E3%81%8A%E3%81%97%E3%82%89%E6%A7%98","おしら様は日本の東北地方で信仰されている家の神であり、一般には蚕の神、農業の神、馬の神とされる。<br>神体の多くは桑の木で作った30cm程度の棒の先に男女の顔や馬の顔を書いたり彫ったりし、布きれで作った衣を多数重ねて着せたもの。<br>伝承園の御蚕神堂（おしらどう）には千体のおしら様が展示されている。","遠野伝承園","http://www.densyoen.jp/index.html","1041051061","1","0","L","104","105","","2017.12.30","2017.12.30"
"1000143","1","38.264972","140.86972","旨味 太助","","","宮城県","仙台市青葉区国分町","","Wikipedia","2018.01.04","https://ja.wikipedia.org/wiki/%E7%89%9B%E3%82%BF%E3%83%B3","牛タンは牛の舌部が食用に供される場合に用いられる名称。仙台牛タン焼きを指す場合もある。<br>仙台牛タン焼きは、一般的な焼肉屋と比べ厚切りの牛タンを、焼き台加熱し、皿に並べて提供される。<br>1948年開業の仙台市内の店「太助」にて1950年に初めてメニューに登場したのが始まりとされる。","牛タン専門店情報サイト 仙台牛タウン","http://www.gyutown.com/index.html","1041061011","1","0","C","104","106","","2018.01.04","2018.01.04"
"1000144","1","38.736259","140.697525","日本こけし館","","","宮城県","大崎市鳴子温泉字尿前","","Wikipedia","2018.01.04","https://ja.wikipedia.org/wiki/%E3%81%93%E3%81%91%E3%81%97","こけしは一般的に球形の頭部と円柱の胴だけの人形玩具。江戸時代末期頃から東北地方の温泉地で土産物として売られ始めた。<br>こけしは本来の様式の伝統こけしと、発展させた新型こけしに分かれる。前者は産地、形式、伝承経緯などで約10種類の系統に分類される。<br>日本こけし館では、様々な系統のこけしを見ることができる。","日本こけし館","http://www.kokesikan.com/","1041061021","1","0","C","104","106","","2018.01.04","2018.01.04"
"1000145","1","38.654924","141.280778","とよま観光物産センター 遠山之里","","","宮城県","登米市登米町寺池桜小路","","Wikipedia","2018.01.04","https://ja.wikipedia.org/wiki/%E3%82%B5%E3%82%B5%E3%83%8B%E3%82%B7%E3%82%AD","ササニシキはイネの品種の1つ。<br>かつてはコシヒカリとともに両横綱と呼ばれた人気品種だったが、耐倒伏性、いもち病抵抗性に弱く、気象被害も受けやすいため、冷害に強いひとめぼれへ転換により作付面積が減少した。<br>ササニシキの産地である登米市の遠山之里では、地元の農産物や加工品を買うことができる。","みやぎの明治村・登米","http://toyoma.co.jp/","1041061031","1","0","C","104","106","","2018.01.04","2018.01.04"
"1000146","1","38.900099","141.579535","海の市　シャークミュージアム","","","宮城県","気仙沼市魚市場前","","Wikipedia","2018.01.04","https://ja.wikipedia.org/wiki/%E6%B0%97%E4%BB%99%E6%B2%BC%E6%BC%81%E6%B8%AF","気仙沼漁港は世界三大漁場の一つである三陸沖を操業域とする漁船の主要な水揚げ港の一つ。日本の遠洋漁業の基地の一つとなっている。<br>気仙沼港は1930年からの漁港修築工事により建設され、1969年に特定第三種漁港の指定を受ける。<br>海の市では気仙沼魚港で水揚げされたの魚介類や加工品を買うことができる。","気仙沼　海の市　シャークミュージアム","http://www.uminoichi.com/index.html","1041061041","1","0","C","104","106","","2018.01.04","2018.01.04"
"1000147","1","38.365923","141.061389","松島公園","","","宮城県","宮城郡松島町松島字浪打浜","","Wikipedia","2018.01.04","https://ja.wikipedia.org/wiki/%E6%9D%BE%E5%B3%B6","松島は宮城県の松島湾内外にある大小260余りの諸島。または、それら諸島と湾周囲を囲む松島丘陵も含めた修景地区。<br>京都府の天橋立、広島県の宮島と並び日本三景の1つに数えられている。<br>260余りの島すべてに名前がつけられており、南から塩竈、松島、奥松島の主に3つの観光地区に分かれている。","電脳松島絵巻 - 松島観光協会","http://www.matsushima-kanko.com/","1041061052","1","0","L","104","106","","2018.01.04","2018.01.04"
"1000148","1","38.255996","140.856665","仙台市博物館","","","宮城県","仙台市青葉区国分町3丁目","","Wikipedia","2018.01.05","https://ja.wikipedia.org/wiki/%E4%BC%8A%E9%81%94%E6%94%BF%E5%AE%97","伊達政宗は出羽国と陸奥国の戦国大名・伊達氏の第17代当主。仙台藩の初代藩主。幼名は梵天丸。<br>幼少時に患った天然痘により右目を失明し、隻眼となったことから後世独眼竜の異名がある。<br>青葉山公園内には仙台城跡、伊達政宗騎馬像などがあり、仙台市博物館では黒漆五枚胴具足が収蔵されている（展示期間要確認）。","仙台市博物館","https://www.city.sendai.jp/museum/","1041061061","1","0","L","104","106","","2018.01.05","2018.01.05"
"1000149","1","34.391377","132.46192","お好み村","","","広島県","広島市中区新天地","","Wikipedia","2018.01.29","https://ja.wikipedia.org/wiki/%E3%81%8A%E5%A5%BD%E3%81%BF%E7%84%BC%E3%81%8D","お好み焼きは小麦粉とキャベツなどを使用する鉄板焼きの一種。焼き方や具材は地域によって差が見られる。<br>広島風お好み焼きは、小麦粉の生地を薄く焼き、具を重ね、ひっくり返して生地でふたをして蒸し焼きにする。中華麺、もやしの具材が特徴。<br>広島市のお好み村はお好み焼き店が多数集まるフードテーマパーク。","元祖広島お好み焼「お好み村」ホームページ","http://www.okonomimura.jp/index.html","1051011011","1","0","C","105","101","","2018.01.29","2018.01.29"
"1000150","1","34.478271","133.345881","明王院","","","広島県","福山市草戸町","","Wikipedia","2018.01.29","https://ja.wikipedia.org/wiki/%E6%98%8E%E7%8E%8B%E9%99%A2_(%E7%A6%8F%E5%B1%B1%E5%B8%82)","明王院は福山市草戸町にある真言宗大覚寺派の仏教寺院。<br>明王院の前身である常福寺は807年に空海によって創建されたといわれる。<br>国宝の五重塔は1348年に建立され、初層内部は極彩色の仏画や文様が描かれている。初層の来迎壁の兜率天曼荼羅図は現在は東京国立博物館の所蔵となっている。","国宝　明王院 オフィシャルホームページ","http://www.chisan.net/myooin/","1051011021","1","0","C","105","101","","2018.01.29","2018.01.29"
"1000151","1","34.670635","132.70147","安芸高田市歴史民俗博物館","","","広島県","安芸高田市吉田町吉田","","Wikipedia","2018.01.29","https://ja.wikipedia.org/wiki/%E6%AF%9B%E5%88%A9%E5%85%83%E5%B0%B1","毛利元就は室町時代後期から戦国時代にかけての安芸の国人領主で、後の戦国大名。<br>安芸の小規模な国人領主から、中国地方のほぼ全域に勢力を拡大し、一代で大国を築いた。三本の矢の逸話は史実と食い違いがあり創作といわれている。<br>安芸高田市歴史民俗博物館では毛利元就や郡山城に関する展示がされている。","安芸高田市歴史民俗博物館","http://www.akitakata.jp/ja/hakubutsukan/","1051011031","1","0","C","105","101","","2018.01.29","2018.01.29"
"1000152","1","34.241382","132.555804","大和ミュージアム","","","広島県","呉市宝町","","Wikipedia","2018.01.29","https://ja.wikipedia.org/wiki/%E5%A4%A7%E5%92%8C_(%E6%88%A6%E8%89%A6)","大和は日本海軍が建造した史上最大の戦艦。当時の日本の最高技術を結集し建造された。<br>1945年4月7日、沖縄方面へ出撃したがアメリカ軍の機動部隊の猛攻撃を受け、坊ノ岬沖で撃沈された。<br>呉市海事歴史科学館は実物の10分の1サイズの戦艦大和の模型が展示されている。愛称は大和ミュージアム。","大和ミュージアム（呉市海事歴史科学館）","http://yamato-museum.com/","1051011041","1","0","L","105","101","","2018.01.29","2018.01.29"
"1000153","1","34.295968","132.319834","厳島神社","","","広島県","廿日市市宮島町","","Wikipedia","2018.01.29","https://ja.wikipedia.org/wiki/%E5%8E%B3%E5%B3%B6%E7%A5%9E%E7%A4%BE","厳島神社は廿日市市の厳島にある神社。<br>593年に有力豪族・佐伯鞍職が社殿造営の神託を受け、勅許を得て御笠浜に社殿を創建したことが始まりとされる。平家からの信仰で有名で、平清盛により現在の海上に立つ大規模な社殿が整えられた。<br>厳島は一般に安芸の宮島とも呼ばれ日本三景の1つに数えられている。","一般社団法人宮島観光協会","http://www.miyajima.or.jp/","1051011051","1","0","R","105","101","","2018.01.29","2018.01.29"
"1000154","1","34.298292","132.321387","厳島門前町","","","広島県","廿日市市宮島町","","Wikipedia","2018.01.29","https://ja.wikipedia.org/wiki/%E3%82%82%E3%81%BF%E3%81%98%E9%A5%85%E9%A0%AD","もみじ饅頭はもみじをかたどった焼饅頭の一種。厳島の名産品。<br>カステラ状の生地で餡を包み、モミジの葉をかたどった型に入れて焼き上げる。<br>現在では広島県を代表する土産菓子として全国的に知名度が高い。もみじ饅頭は明治時代後期の和菓子職人が考案したが商標権は切れており、複数のメーカーが存在する。","","","1051011061","1","0","L","105","101","もみじ饅頭の店舗は多くあるため、関連リンクを設定していません。","2018.01.29","2018.01.29"
"1000155","1","34.093781","131.396354","新山口駅","","","山口県","山口市小郡下郷","","Wikipedia","2018.02.01","https://ja.wikipedia.org/wiki/SL%E3%82%84%E3%81%BE%E3%81%90%E3%81%A1%E5%8F%B7","SLやまぐち号はJR西日本が山口線の新山口駅、津和野駅間で運行している臨時快速列車。<br>基本的にSL1両+客車5両の編成で3月中旬から11月下旬までの週末（土曜、日曜、祝日）および夏休み、GWなどに1日1往復が運転される。<br>客車の牽引はC57 1が使用される。8月にはC56 160と重連となる。","SL「やまぐち」号","http://www.c571.jp/","1051021011","1","0","R","105","102","","2018.02.01","2018.02.01"
"1000156","1","34.037065","131.873152","花岡福徳稲荷社","","","山口県","下松市末武上","","Wikipedia","2018.02.01","https://ja.wikipedia.org/wiki/%E7%8B%90%E3%81%AE%E5%AB%81%E5%85%A5%E3%82%8A","狐の嫁入りは天気雨、怪談としての異様な嫁入り行列や怪火の列。現代においては、それらにちなんだ神事や祭事。<br>山口県下松市の花岡福徳稲荷社では、毎年11月3日の稲穂祭で「きつねの嫁入り」が行われる。<br>演じられるキツネ夫婦は下松市民から選ばれるが、新婦役となった女性は良縁に恵まれると言われている。","きつねの嫁入り","http://www.h.do-up.com/home/taka0716/","1051021021","1","0","C","105","102","","2018.02.01","2018.02.01"
"1000157","1","34.167595","132.17841","錦帯橋","","","山口県","山口県岩国市岩国1丁目","錦川","Wikipedia","2018.02.01","https://ja.wikipedia.org/wiki/%E9%8C%A6%E5%B8%AF%E6%A9%8B","錦帯橋は岩国市の錦川に架橋された木造のアーチ橋。<br>1673年に建造され、以降、度々架け替え工事が行われている。<br>5連のアーチからなり、全長193.3m、幅員5.0m、主要構造部は組木の技術によって釘は1本も使わずに造られている。日本三名橋や日本三大奇橋に数えられ、名勝に指定されている。","【錦帯橋】岩国市公式ホームページTOP","http://kintaikyo.iwakuni-city.net/","1051021034","1","0","L","105","102","","2018.02.01","2018.02.01"
"1000158","1","34.41212","131.418238","松陰神社","","","山口県","萩市椿東","","Wikipedia","2018.02.01","https://ja.wikipedia.org/wiki/%E5%90%89%E7%94%B0%E6%9D%BE%E9%99%B0","吉田松陰は日本の武士、思想家、教育者。一般的に明治維新の精神的指導者・理論者・倒幕論者として知られる。<br>私塾「松下村塾」で、後の明治維新で重要な働きをする多くの若者に思想的影響を与えた。<br>松陰神社の境内には松下村塾が現存している。また松陰幽囚の旧宅・吉田松陰歴史館などがある。","宗教法人松陰神社","http://shoin-jinja.jp/","1051021041","1","0","C","105","102","","2018.02.01","2018.02.01"
"1000159","1","33.956639","130.945876","唐戸市場","","","山口県","下関市唐戸町","","Wikipedia","2018.02.01","https://ja.wikipedia.org/wiki/%E4%B8%8B%E9%96%A2%E3%81%A8%E3%81%B5%E3%81%8F","下関は日本で水揚げされる天然のトラフグやクサフグなど8割近くが集まり、また長崎県や熊本県で、主に生産される養殖トラフグの大部分が集まる一大集積地。<br>毒を持つ内臓部分などが除去する加工が成されたあと、東京や大阪の消費地へと運ばれる。<br>1933年に開設された唐戸魚市場はフグの取引所として知られる。","唐戸市場","http://www.karatoichiba.com/","1051021051","1","0","R","105","102","","2018.02.01","2018.02.01"
"1000160","1","34.532198","133.5821","鴨方郷土資料館","","","岡山県","浅口市鴨方町鴨方","","Wikipedia","2018.02.03","https://ja.wikipedia.org/wiki/%E9%BA%A6%E3%82%8F%E3%82%89%E5%B8%BD%E5%AD%90","麦わら帽子は藁あるいは藁様の素材で編んだ帽子。<br>岡山県は麦わら帽子の有名な産地の一つである。麦わら（麦稈真田）作りは明治から戦前にかけて浅口郡の農家の副業として盛んに行われていた。<br>浅口市の鴨方郷土資料館では、麦稈真田のかつての主産地であったことから、製造道具等が展示されている。","浅口市／鴨方郷土資料館","http://www.city.asakuchi.lg.jp/shisetsu/bunka/images/kamogatakyoudo.html","1051031011","1","0","R","105","103","","2018.02.03","2018.02.03"
"1000161","1","34.738751","134.160282","備前焼伝統産業会館","","","岡山県","備前市伊部","","Wikipedia","2018.02.03","https://ja.wikipedia.org/wiki/%E5%82%99%E5%89%8D%E7%84%BC","備前焼は備前市周辺を産地とする炻器。釉薬を使わず酸化焔焼成による堅く締められた赤みの強い味わいや、窯変による同じものがない模様が特徴。<br>備前周辺は古墳時代から平安時代にかけての須恵器窯跡が点在し、これが備前焼に発展したといわれる。<br>備前焼伝統産業会館では、備前焼の購入や体験（要予約）が可能。","協同組合岡山県備前焼陶友会","http://touyuukai.jp/","1051031021","1","0","L","105","103","","2018.02.03","2018.02.03"
"1000162","1","34.971663","133.583436","満奇洞","","","岡山県","新見市豊永赤馬","","Wikipedia","2018.02.03","https://ja.wikipedia.org/wiki/%E6%BA%80%E5%A5%87%E6%B4%9E","満奇洞は新見市にある鍾乳洞。<br>江戸時代末期、狸猟をしていた猟師により偶然発見された。名称の由来は1929年に歌人の与謝野鉄幹・晶子夫妻が「奇に満ちた洞」と詠んだことからといわれている。<br>内部は高低がさほどない全長約450mの洞窟が続いている。ライトアップされ幻想的な雰囲気が楽しめる。","新見市観光協会 新発見のまち！ にいみ","http://www.niimi.gr.jp/","1051031031","1","0","C","105","103","","2018.02.03","2018.02.03"
"1000163","1","34.59606","133.771888","倉敷考古館","","","岡山県","倉敷市中央","","Wikipedia","2018.02.03","https://ja.wikipedia.org/wiki/%E5%80%89%E6%95%B7%E7%BE%8E%E8%A6%B3%E5%9C%B0%E5%8C%BA","倉敷美観地区は倉敷市にある町並保存地区。<br>1642年に江戸幕府の天領に定められ、物資の集散地として発展した。倉敷川の畔から鶴形山南側の街道一帯に白壁なまこ壁の屋敷や蔵が並び、天領時代の町並みを残している。<br>倉敷考古観は江戸時代の倉を改装した考古博物館。遺跡の多い吉備地方の展示がされている。","倉敷考古館","http://www.kurashikikoukokan.com/","1051031041","1","0","C","105","103","","2018.02.03","2018.02.03"
"1000164","1","34.670717","133.850653","吉備津神社","","","岡山県","岡山市北区吉備津","","Wikipedia","2018.02.03","https://ja.wikipedia.org/wiki/%E5%90%89%E5%82%99%E6%B4%A5%E7%A5%9E%E7%A4%BE","吉備津神社は岡山市北区吉備津にある神社。<br>本来は吉備国の総鎮守であったが、689年に吉備国が備前国、備中国、備後国に分割され、備中国の一宮となった。備前国、備後国にも吉備津彦神社（岡山県）、吉備津神社（広島県）がある。<br>吉備津神社には桃太郎のモチーフとなった温羅退治の話が伝わっている。","吉備津神社","http://www.kibitujinja.com/","1051031051","1","0","L","105","103","","2018.02.03","2018.02.03"
"1000165","1","35.540723","134.22907","鳥取砂丘","","","鳥取県","鳥取市福部町湯山","","Wikipedia","2018.02.11","https://ja.wikipedia.org/wiki/%E9%B3%A5%E5%8F%96%E7%A0%82%E4%B8%98","鳥取砂丘は鳥取市の日本海海岸に広がる広大な砂礫地。<br>観光可能な砂丘としては日本最大で、南北2.4km、東西16kmに広がり、3本の砂丘列が日本海とほぼ平行に走っている。<br>中国山地の花崗岩質の岩石が風化し、千代川によって日本海へ流されたあと、海岸に集まったものが砂丘の主な砂となっている。","鳥取市観光コンベンション協会","http://www.torican.jp/","1051041011","1","0","R","105","104","","2018.02.12","2018.02.12"
"1000166","1","35.545057","133.223824","水木しげるロード","","","鳥取県","鳥取県境港市大正町","","Wikipedia","2018.02.11","https://ja.wikipedia.org/wiki/%E6%B0%B4%E6%9C%A8%E3%81%97%E3%81%92%E3%82%8B%E3%83%AD%E3%83%BC%E3%83%89","水木しげるロードは境港市にある商店街の名称。<br>漫画家・水木しげるが描く妖怪の世界観をテーマとした観光名所として知られている。<br>境港駅から本町アーケードまでの全長約800メートルの間に、代表作『ゲゲゲの鬼太郎』のキャラクターを中心に妖怪たちをモチーフとした銅像など多数のオブジェが設置されている。","境港市観光協会","http://www.sakaiminato.net/","1051041021","1","0","C","105","104","","2018.02.12","2018.02.12"
"1000167","1","35.396523","133.959454","三仏寺","投入堂","","鳥取県","東伯郡三朝町三徳","","Wikipedia","2018.02.11","https://ja.wikipedia.org/wiki/%E4%B8%89%E4%BB%8F%E5%AF%BA","投入堂は三朝町にある三徳山三仏寺の奥院。山の断崖の窪みに建造されている。<br>三仏寺の開祖とされる役小角が蔵王権現などを祀った仏堂を法力で山に投げ入れた言い伝えから「投入堂」と呼ばれる。投入堂に行く登山道は入山制限がある（要確認）。<br>木造蔵王権現立像は三仏寺の宝物殿で見ることができる。","三徳山三佛寺 国宝投入堂","http://www.mitokusan.jp/","1051041031","1","0","R","105","104","","2018.02.12","2018.02.12"
"1000168","1","35.345872","133.375328","金田川ホタルの里","","","鳥取県","西伯郡南部町金田","","Wikipedia","2018.02.11","https://ja.wikipedia.org/wiki/%E3%83%9B%E3%82%BF%E3%83%AB","ホタルは発光することで知られる昆虫。<br>日本でホタルは40種以上生息するが、本州以南の各地に分布し、5月から6月にかけて孵化するゲンジボタルを指すことが多い。<br>自然回復や河川の浄化の取り組みとしてホタルの保護や放流が行われるようになっている。ホタルの名所は日本全国にあり、鳥取県南部町もその一つ。","鳥取県西伯郡・南部町観光協会","http://www.town.nanbu.tottori.jp/kanko/","1051041041","1","0","L","105","104","","2018.02.12","2018.02.12"
"1000169","1","35.414465","134.248196","白兎神社","","","鳥取県","八頭郡八頭町福本 ","","Wikipedia","2018.02.12","https://ja.wikipedia.org/wiki/%E7%99%BD%E5%85%8E%E7%A5%9E%E7%A4%BE","白兎神社は鳥取市に所在する神社。日本神話に登場する因幡の白兎を主祭神とする。<br>また、山間の八頭町に3つの白兎神社が福本（本社）、土師百井、池田それぞれにあり、天照大神が行幸の際、白兎が現れて天伊勢ヶ平まで案内した伝承が残っている。<br>いづれも同町の賀茂神社に合祀され、形式上は廃社となっている。","やずナビ","http://yazukanko.jp/","1051041051","1","0","L","105","104","","2018.02.12","2018.02.12"
